,,,,
0,git,status,,"Displays the status of your working directory. Options include new, staged, and modified files. It will retrieve branch name, current commit identifier, and changes pending commit."
1,git,add,[file],Add a file to the staging area. Use. in place of the full file path to add all changed files from the current directory down into the directory tree.
2,git,diff,[file],Show changes between working directory and staging area.
3,git,diff,--staged [file],Shows any changes between the staging area and the repository.
4,git,checkout,-- [file],Discard changes in working directory. This operation is unrecoverable.
5,git,reset,<path>...],Revert some paths in the index (or the whole index) to their state in HEAD.
6,git,commit,,Create a new commit from changes added to the staging area. The commit must have a message!
